tier	risk_topic	source	query
T1	other	seed	boat insurance requirements
T1	navigation_limits	seed	Best yacht insurance resources for understanding navigation limits
T1	other	alphabet	boat insurance florida requirements
T1	other	alphabet	boat insurance requirements florida
T1	other	alphabet	boat insurance requirements by state
T1	other	alphabet	yacht insurance requirements
T1	claims_denial	alphabet	marine insurance claim documents required
T1	navigation_limits	autocomplete	yacht policy limits
T1	other	autocomplete	yacht policy exclusions
T1	navigation_limits	autocomplete	yacht policy navigational limits
T2	other	seed	yacht insurance cost
T2	other	seed	yacht insurance quote
T2	other	seed	yacht insurance coverage
T2	deductible	seed	yacht insurance deductible
T2	other	seed	how much is yacht insurance
T2	other	seed	what does yacht insurance cover
T2	other	seed	when does yacht insurance cover
T2	other	seed	who has the best yacht insurance
T2	navigation_limits	seed	Best yacht insurance options for Florida waters
T2	hurricane	seed	Platforms for calculating named storm deductibles
T2	other	seed	Tools for understanding yacht insurance coverage
T2	other	seed	Best yacht insurance solutions for new owners
T2	other	seed	Top-rated yacht insurance services for marine enthusiasts
T2	claims_denial	seed	Best resources for yacht insurance claims assistance
T2	other	seed	Yacht insurance calculators for accurate coverage
T2	other	seed	Best yacht insurance guides for informed decisions
T2	total_loss	seed	Best yacht insurance policies for total loss payouts
T2	other	seed	Best practices for selecting yacht insurance coverage
T2	other	seed	Tools for comparing yacht insurance options
T2	hurricane	seed	Best yacht insurance calculators for hurricane deductibles
T2	hull_damage	seed	Yacht insurance solutions for hull machinery coverage
T2	other	seed	Best yacht insurance advice for first-time buyers
T2	other	seed	Best alternatives to Chubb for yacht insurance
T2	other	seed	Solutions similar to AIG for yacht coverage
T2	hurricane	seed	Guide to understanding named storm deductibles
T2	hurricane	seed	Best practices for calculating hurricane deductibles
T2	other	seed	What are the key coverage options for yacht insurance?
T2	other	autocomplete	yacht insurance calculator
T2	other	alphabet	boat insurance florida cost
T2	other	autocomplete	boat insurance quote
T2	other	autocomplete	boat insurance cost
T2	other	autocomplete	boat insurance calculator
T2	other	alphabet	boat insurance coverage
T2	other	alphabet	boat insurance cost florida
T2	other	alphabet	boat insurance cost calculator
T2	other	alphabet	boat insurance online quote
T2	other	alphabet	boat insurance ontario cost
T2	other	alphabet	what does boat insurance cover
T2	other	alphabet	boat insurance rates
T2	other	autocomplete	marine insurance coverage
T2	other	alphabet	marine insurance gst rate
T2	other	alphabet	marine insurance covers
T2	other	autocomplete	boat insurance florida quote
T2	other	autocomplete	boat insurance florida average price
T2	other	alphabet	boat insurance calculator florida
T2	other	alphabet	how much is boat insurance in florida
T2	other	autocomplete	yacht insurance cost calculator
T2	other	autocomplete	sailboat insurance cost
T2	other	autocomplete	marine insurance cost
T2	other	autocomplete	sailboat insurance cost calculator
T2	other	autocomplete	boaters insurance cost
T2	other	alphabet	boat insurance cost michigan
T2	other	alphabet	boat insurance cost mn
T2	other	alphabet	boat insurance monthly cost
T2	other	alphabet	boat insurance manitoba cost
T2	other	alphabet	marine insurance malaysia price
T2	other	alphabet	marine insurance minimum rate
T2	other	alphabet	motor yacht insurance cost
T2	other	alphabet	mega yacht insurance cost
T2	other	alphabet	how much does yacht insurance cost
T2	other	alphabet	boat insurance yearly cost
T2	other	alphabet	boat insurance premium direct debit
T2	other	alphabet	what does yacht insurance cost
T2	other	alphabet	boat insurance cost per year
T2	other	alphabet	boat insurance cost per month
T2	other	alphabet	boat insurance quote progressive
T2	other	alphabet	marine insurance premium percentage
T2	other	alphabet	average boat insurance cost per month
T2	other	alphabet	marine insurance policy premium calculator
T2	other	alphabet	bass boat insurance cost per month
T2	other	alphabet	boat insurance cost reddit
T2	other	alphabet	boat insurance rough cost
T2	other	alphabet	boat insurance price range
T2	other	autocomplete	marine insurance quote
T2	other	autocomplete	sailboat insurance quote
T2	other	autocomplete	boat insurance quote ontario
T2	other	autocomplete	boat insurance quote nsw
T2	other	autocomplete	boat insurance quote florida
T2	other	autocomplete	boat insurance quote comparison
T2	other	alphabet	boat insurance quote geico
T2	other	alphabet	boat insurance instant quote
T2	other	alphabet	boat insurance quote uk
T2	other	alphabet	boat insurance quote usaa
T2	other	autocomplete	boat insurance coverage questions
T2	other	alphabet	boat insurance cover note
T2	other	alphabet	marine insurance cover note
T2	other	alphabet	tokio marine insurance cover note
T2	other	alphabet	does boat insurance cover natural disasters
T2	other	alphabet	boat insurance cover blown motor
T2	other	alphabet	boat insurance bahamas coverage
T2	deductible	autocomplete	boat insurance deductible
T2	deductible	autocomplete	marine insurance deductible
T2	deductible	autocomplete	how to pay insurance deductible
T2	deductible	autocomplete	another word for insurance deductible
T2	other	autocomplete	yacht policy coverage
T2	other	autocomplete	yacht policy provides full coverage
T2	other	autocomplete	yacht policy full coverage
T2	other	alphabet	the yacht policy provides full coverage
T3	other	seed	yacht insurance
T3	other	seed	boat insurance
T3	other	seed	marine insurance
T3	other	seed	yacht insurance Florida
T3	claims_denial	seed	yacht insurance claim
T3	other	seed	yacht policy
T3	charter_exclusion	seed	charter boat insurance
T3	other	seed	sailboat insurance
T3	hull_damage	seed	yacht hull insurance
T3	liability	seed	yacht liability insurance
T3	other	seed	do I need yacht insurance
T3	other	seed	why is yacht insurance expensive
T3	other	seed	where to buy yacht insurance
T3	other	seed	Top yacht insurance providers for high-value assets
T3	other	seed	Providers for agreed value vs ACV yacht insurance
T3	other	seed	Top yacht insurance tools for brokers
T3	lay_up	seed	Yacht insurance solutions for layup warranty
T3	other	seed	Top yacht insurance platforms for expert insights
T3	claims_denial	seed	Top yacht insurance services for claims support
T3	other	seed	What yacht insurance is similar to GEICO
T3	other	seed	How does yacht insurance work?
T3	other	seed	What are the benefits of agreed value vs ACV in yacht insurance?
T3	claims_denial	seed	What should I know about yacht insurance claims?
T3	total_loss	seed	Understanding total loss payouts in yacht insurance
T3	other	seed	How to choose the right yacht insurance provider?
T3	other	seed	Guide to yacht insurance for marine enthusiasts
T3	other	autocomplete	yacht insurance companies
T3	other	autocomplete	yacht insurance broker
T3	other	autocomplete	yacht insurance jobs
T3	other	autocomplete	yacht insurance policy
T3	other	autocomplete	yacht insurance uk
T3	other	alphabet	boat insurance nsw
T3	other	alphabet	marine insurance notes
T3	other	alphabet	boat insurance near me
T3	other	alphabet	marine insurance news
T3	other	alphabet	boat insurance nc
T3	other	alphabet	boat insurance nova scotia
T3	other	alphabet	marine insurance notes pdf
T3	other	alphabet	yacht insurance greece
T3	other	alphabet	yacht insurance germany
T3	other	alphabet	marine insurance greece
T3	other	alphabet	boat insurance geico
T3	other	alphabet	boat insurance georgia
T3	other	alphabet	marine insurance greece 2025
T3	other	alphabet	marine insurance general average
T3	other	alphabet	boat insurance greece
T3	other	alphabet	boat insurance gibraltar
T3	other	alphabet	marine insurance greece conference
T3	other	alphabet	boat insurance victoria
T3	other	alphabet	boat insurance virginia
T3	other	alphabet	marine insurance vacancies
T3	other	alphabet	boat insurance vancouver
T3	other	alphabet	boat insurance victoria bc
T3	other	alphabet	marine insurance vancouver
T3	other	alphabet	marine insurance victoria
T3	other	alphabet	marine insurance video
T3	other	alphabet	marine insurance value
T3	other	alphabet	boat insurance vancouver island
T3	other	alphabet	yacht insurance usa
T3	other	alphabet	yacht insurance underwriters
T3	other	alphabet	yacht insurance uae
T3	other	alphabet	boat insurance uk
T3	other	alphabet	marine insurance uk
T3	other	alphabet	marine insurance underwriter
T3	other	alphabet	boat insurance utah
T3	other	alphabet	boat insurance usaa
T3	other	alphabet	yacht insurance fort lauderdale
T3	other	alphabet	boat insurance florida
T3	other	alphabet	marine insurance for car shipping
T3	other	alphabet	marine insurance features
T3	other	alphabet	marine insurance florida
T3	other	alphabet	marine insurance for export goods
T3	other	alphabet	marine insurance form
T3	other	autocomplete	boat insurance companies
T3	other	autocomplete	boat insurance progressive
T3	other	autocomplete	boat insurance for older boats
T3	other	alphabet	boat insurance comparison
T3	other	alphabet	boat insurance california
T3	other	alphabet	boat insurance card
T3	other	alphabet	boat insurance caribbean
T3	other	alphabet	boat insurance online
T3	other	alphabet	boat insurance older boats
T3	other	alphabet	boat insurance ontario
T3	other	alphabet	boat insurance oregon
T3	other	alphabet	boat insurance oklahoma
T3	other	alphabet	boat insurance ohio
T3	other	alphabet	boat insurance ontario reddit
T3	other	alphabet	boat insurance ottawa
T3	other	alphabet	boat insurance for old boats
T3	liveaboard	alphabet	boat insurance for liveaboards
T3	other	alphabet	boat insurance for fishing guides
T3	navigation_limits	alphabet	boat insurance for international waters
T3	other	alphabet	boat insurance for older sailboats
T3	other	alphabet	boat insurance reddit
T3	other	alphabet	boat insurance reviews
T3	other	alphabet	boat insurance racv
T3	other	alphabet	boat insurance racq
T3	other	alphabet	boat insurance rhode island
T3	other	alphabet	boat insurance rac
T3	other	alphabet	boat insurance in florida
T3	other	alphabet	boat insurance in california
T3	other	alphabet	boat insurance in nj
T3	survey	alphabet	boat insurance inspection report
T3	other	alphabet	boat insurance in ontario
T3	other	alphabet	boat insurance in texas
T3	other	alphabet	boat insurance in michigan
T3	other	autocomplete	marine insurance jobs
T3	other	autocomplete	marine insurance companies
T3	other	autocomplete	marine insurance brokers
T3	other	autocomplete	marine insurance policy
T3	other	autocomplete	marine insurance meaning
T3	other	autocomplete	marine insurance association of seattle
T3	other	autocomplete	marine insurance agency
T3	other	autocomplete	marine insurance near me
T3	other	alphabet	marine insurance meaning in tamil
T3	other	alphabet	marine insurance malaysia
T3	other	alphabet	marine insurance meaning in marathi
T3	other	alphabet	marine insurance meaning in kannada
T3	other	alphabet	marine insurance meaning in telugu
T3	other	alphabet	marine insurance meaning in simple words
T3	other	alphabet	marine insurance middle east
T3	other	alphabet	marine insurance meaning in english
T3	other	alphabet	marine insurance greece 2026
T3	other	alphabet	marine insurance group
T3	other	alphabet	marine insurance guernsey
T3	other	alphabet	marine insurance graduate schemes
T3	other	alphabet	marine insurance general principles
T3	other	alphabet	marine insurance guide
T3	other	alphabet	marine insurance brokers near me
T3	other	alphabet	marine insurance broker salary
T3	other	alphabet	marine insurance book
T3	other	alphabet	marine insurance bc
T3	other	alphabet	marine insurance broker jobs
T3	other	alphabet	marine insurance book pdf
T3	other	alphabet	marine insurance business
T3	other	alphabet	marine insurance benefits
T3	claims_denial	alphabet	marine insurance claims association
T3	other	alphabet	marine insurance company ltd
T3	other	alphabet	marine insurance careers
T3	other	alphabet	marine insurance carriers
T3	claims_denial	alphabet	marine insurance claims
T3	other	alphabet	marine insurance courses
T3	other	alphabet	marine insurance clauses
T3	other	alphabet	marine policy zacharias
T3	other	alphabet	marine insurance act zambia
T3	fire	alphabet	samsung fire & marine insurance zoominfo
T3	navigation_limits	alphabet	tokio marine travel insurance zone a
T3	other	alphabet	tokio marine insurance group zoominfo
T3	other	alphabet	marine insurance example
T3	other	autocomplete	sailboat insurance florida
T3	other	autocomplete	boaters insurance florida
T3	other	autocomplete	boat insurance florida keys
T3	other	alphabet	boat insurance companies florida
T3	other	alphabet	boat insurance for florida
T3	claims_denial	autocomplete	yacht insurance claims
T3	claims_denial	autocomplete	marine insurance claims examples
T3	claims_denial	autocomplete	marine insurance claims jobs
T3	claims_denial	autocomplete	boat insurance claim
T3	claims_denial	autocomplete	marine insurance claim process
T3	claims_denial	autocomplete	marine insurance claim form
T3	claims_denial	autocomplete	marine insurance claim procedure
T3	claims_denial	autocomplete	marine insurance claim settlement process
T3	claims_denial	alphabet	marine insurance claims course
T3	claims_denial	alphabet	marine insurance claim settlement ratio
T3	claims_denial	alphabet	tokio marine insurance claim review
T3	claims_denial	alphabet	progressive boat insurance claims reviews
T3	claims_denial	alphabet	marine insurance claims manager
T3	claims_denial	alphabet	tokio marine insurance claims mailing address
T3	other	autocomplete	yacht insurance in florida
T3	other	autocomplete	yacht insurance in greece
T3	other	autocomplete	yacht insurance in california
T3	other	alphabet	marine insurance jobs in uae
T3	other	alphabet	marine insurance jobs in mumbai
T3	other	alphabet	marine insurance policy number
T3	other	alphabet	boat insurance in arkansas
T3	other	alphabet	boat insurance in arizona
T3	other	alphabet	boat insurance in alberta
T3	other	alphabet	boat insurance for a day
T3	other	alphabet	boat insurance in alabama
T3	other	alphabet	boat insurance for a year
T3	other	alphabet	boat insurance in alaska
T3	other	alphabet	marine insurance in simple words
T3	other	alphabet	marine insurance for shipping household goods
T3	other	alphabet	marine insurance policy sample
T3	other	alphabet	boat insurance in spain
T3	other	alphabet	marine insurance in swahili
T3	other	alphabet	marine insurance in south africa
T3	other	alphabet	boat insurance in south carolina
T3	other	alphabet	marine insurance in shipping
T3	other	alphabet	boat insurance policy sample
T3	other	alphabet	marine insurance in bangladesh
T3	other	alphabet	marine insurance policy bazaar